{
  "record_type": "ValidationRecord",
  "record_id": "pgw:l:595fcd28f93b03437b2d8eff4873b06c",
  "created_at": "2026-08-04T06:01:00.000Z",
  "responsible_role": "trusted-validator",
  "registry_snapshot_reference": {
    "registry_protocol_id": "project-gateway.registry",
    "registry_snapshot_format_version": "1.0",
    "registry_snapshot_id": "pgw:g:3fb51a11f2b23ba8c171326cbba7eb64",
    "registry_snapshot_digest": "sha-256:613112612ee7803db00c6e51826b3a63ee6ce6732b17c9b09ae8aff00db47c05",
    "protocol_compatibility": {
      "mode": "exact-release",
      "artifact_protocol_id": "project-gateway.artifact",
      "artifact_protocol_version": "1.0"
    }
  },
  "subject": {
    "protocol_version": "1.0",
    "kind": {
      "id": "ExecutionResult",
      "version": "1.0"
    },
    "instance_id": "pgw:i:8b13ff16e5e2ab55f9545ce171fdfb7c",
    "revision_id": "pgw:r:66f1c853ded0e0f67d4392d6c8b792fa",
    "digest": "sha-256:551a37acb15610ce49f4ad0d23743710f5f9c1a29fec423cf5b0a414c4611500",
    "workspace_id": "pgw:w:cf4339b1f56441936467dea1357dc30e"
  },
  "validator_profile": {
    "id": "project-gateway.structural-semantic-v1",
    "version": "1.0"
  },
  "structural_outcome": "pass",
  "semantic_outcome": "pass",
  "findings": []
}
